{
  "doc_id": "synth-4db89e315ffc",
  "source_path": "corpus/synth-prototype/gp_medical/synth-4db89e315ffc.pdf",
  "schema_version": "0.4",
  "contracts_version": "0.4.2-step0.1",
  "template_family": "gp_medical",
  "corruption_bucket": "clean",
  "ground_truth_fields": {
    "vendor": "Dr. Ruari Mulqueen Family Doctors",
    "total": 69.21,
    "vat": 0.0,
    "date": "01/04/2026",
    "subtotal": 69.21,
    "vendor_country": "IE"
  },
  "ground_truth_line_items": [
    {
      "description": "Standard GP consultation fee",
      "quantity": 1.0,
      "unit_price": 69.21,
      "vat_rate_pct": 0.0,
      "vat_letter_code": "EXEMPT",
      "amount_net": 69.21,
      "amount_vat": 0.0,
      "amount_gross": 69.21
    }
  ],
  "ground_truth_header": {
    "vendor_name": "Dr. Ruari Mulqueen Family Doctors",
    "vendor_address_line1": "30 O'Murnaghan Street",
    "vendor_address_line2": "",
    "vendor_city": "Sligo",
    "vendor_eircode": "F91 35MC",
    "vendor_country": "IE",
    "vendor_phone": "+353 817 724 7478",
    "vendor_email": "nicholas15@sheane.com",
    "vendor_website": "",
    "vendor_vat_number": "IE5315399A",
    "vendor_iban": "IE34IPBS36614760918773",
    "vendor_bic": "IPBSIE2DXXX",
    "vendor_logo_present": "",
    "invoice_number": "GP-202604-332",
    "invoice_date": "01/04/2026",
    "due_date": "15/04/2026",
    "po_reference": ""
  },
  "ground_truth_provenance": {
    "original_form": "digital_native",
    "source_engine": "weasyprint-68.1+jinja2",
    "file_sha256": "6996db389187768ceb5f9301696dd661ae92e86d65be980f3391e703f335195b",
    "file_size_bytes": 19217,
    "ingest_timestamp_utc": "2026-05-04T17:33:43Z",
    "page_count": 1,
    "vatca_attestation": "original-form-preserved"
  },
  "synthetic_seed": 42000,
  "synthetic_generator_commit": "2284ec7dd2fab67c23c8c0b068ac6b638896c07a",
  "license_tag": "Apache-2.0"
}