{
  "doc_id": "synth-5e7b1c731c73",
  "source_path": "corpus/synth-prototype/professional_services/synth-5e7b1c731c73.pdf",
  "schema_version": "0.4",
  "contracts_version": "0.4.2-step0.1",
  "template_family": "professional_services",
  "corruption_bucket": "clean",
  "ground_truth_fields": {
    "vendor": "Cogley Chartered Accountants",
    "total": 346.68,
    "vat": 64.83,
    "date": "30/04/2026",
    "subtotal": 281.85,
    "vendor_country": "IE"
  },
  "ground_truth_line_items": [
    {
      "description": "Payroll bureau service (per month, 1-10 staff)",
      "quantity": 1.0,
      "unit_price": 281.85,
      "vat_rate_pct": 23.0,
      "vat_letter_code": null,
      "amount_net": 281.85,
      "amount_vat": 64.83,
      "amount_gross": 346.68
    }
  ],
  "ground_truth_header": {
    "vendor_name": "Cogley Chartered Accountants",
    "vendor_address_line1": "43 Quin Street",
    "vendor_address_line2": "Suite 21",
    "vendor_city": "Galway",
    "vendor_eircode": "H91 TN35",
    "vendor_country": "IE",
    "vendor_phone": "+353 870 667 2383",
    "vendor_email": "walterdaire@logan.biz",
    "vendor_website": "",
    "vendor_vat_number": "IE8470644HF",
    "vendor_iban": "IE36AIBK67612821308952",
    "vendor_bic": "AIBKIE2DXXX",
    "vendor_logo_present": "",
    "invoice_number": "INV-20260430-437",
    "invoice_date": "30/04/2026",
    "due_date": "",
    "po_reference": ""
  },
  "ground_truth_provenance": {
    "original_form": "digital_native",
    "source_engine": "weasyprint-68.1+jinja2",
    "file_sha256": "3e558c45c4d55b5d6f5f61b627a0ce2a5fb43474aa1a3415a7ddb96a1ba0c582",
    "file_size_bytes": 18181,
    "ingest_timestamp_utc": "2026-05-04T17:52:55Z",
    "page_count": 1,
    "vatca_attestation": "original-form-preserved"
  },
  "synthetic_seed": 42003,
  "synthetic_generator_commit": "f530abec55959e790d43bc715fa59bc08bcb9c70",
  "license_tag": "Apache-2.0"
}