{
  "doc_id": "synth-63e6e6aaf756",
  "source_path": "corpus/synth-prototype/utility_bill/synth-63e6e6aaf756.pdf",
  "schema_version": "0.4",
  "contracts_version": "0.4.2-step0.1",
  "template_family": "utility_bill",
  "corruption_bucket": "clean",
  "ground_truth_fields": {
    "vendor": "Virgin Media Ireland",
    "total": 94.3,
    "vat": 9.29,
    "date": "01/04/2026",
    "subtotal": 85.01,
    "vendor_country": "IE"
  },
  "ground_truth_line_items": [
    {
      "description": "PSO levy (Public Service Obligation)",
      "quantity": 1.0,
      "unit_price": 16.21,
      "vat_rate_pct": 0.0,
      "vat_letter_code": null,
      "amount_net": 16.21,
      "amount_vat": 0.0,
      "amount_gross": 16.21
    },
    {
      "description": "Electricity usage (kWh) — night rate",
      "quantity": 1.0,
      "unit_price": 68.8,
      "vat_rate_pct": 13.5,
      "vat_letter_code": null,
      "amount_net": 68.8,
      "amount_vat": 9.29,
      "amount_gross": 78.09
    }
  ],
  "ground_truth_header": {
    "vendor_name": "Virgin Media Ireland",
    "vendor_address_line1": "30 O'Murnaghan Street",
    "vendor_address_line2": "",
    "vendor_city": "Cork",
    "vendor_eircode": "T23 CF4Z",
    "vendor_country": "IE",
    "vendor_phone": "+353 853 791 2158",
    "vendor_email": "nicholas15@sheane.com",
    "vendor_website": "",
    "vendor_vat_number": "IE5399830XH",
    "vendor_iban": "IE71REVO61476091877311",
    "vendor_bic": "REVOIE23",
    "vendor_logo_present": "",
    "invoice_number": "BIL-20260401-39767",
    "invoice_date": "01/04/2026",
    "due_date": "15/04/2026",
    "po_reference": ""
  },
  "ground_truth_provenance": {
    "original_form": "digital_native",
    "source_engine": "weasyprint-68.1+jinja2",
    "file_sha256": "d7ef30e6458ae0bc2b62da8e7906d680b0aa3d425841e78f29f61c32f811f9a1",
    "file_size_bytes": 18553,
    "ingest_timestamp_utc": "2026-05-04T17:52:59Z",
    "page_count": 1,
    "vatca_attestation": "original-form-preserved"
  },
  "synthetic_seed": 42000,
  "synthetic_generator_commit": "f530abec55959e790d43bc715fa59bc08bcb9c70",
  "license_tag": "Apache-2.0"
}