{
  "doc_id": "synth-d987de1bef12",
  "source_path": "corpus/synth-prototype/solicitor_loe/synth-d987de1bef12.pdf",
  "schema_version": "0.4",
  "contracts_version": "0.4.2-step0.1",
  "template_family": "solicitor_loe",
  "corruption_bucket": "clean",
  "ground_truth_fields": {
    "vendor": "Kinsella Mulqueen Legal Services",
    "total": 1886.71,
    "vat": 331.86,
    "date": "01/04/2026",
    "subtotal": 1554.85,
    "vendor_country": "IE"
  },
  "ground_truth_line_items": [
    {
      "description": "Conveyancing — residential purchase (legal fee)",
      "quantity": 1.0,
      "unit_price": 1442.87,
      "vat_rate_pct": 23.0,
      "vat_letter_code": null,
      "amount_net": 1442.87,
      "amount_vat": 331.86,
      "amount_gross": 1774.73
    },
    {
      "description": "Land Registry — Form 17 outlay [Outlay]",
      "quantity": 1.0,
      "unit_price": 84.03,
      "vat_rate_pct": 0.0,
      "vat_letter_code": "OUTLAY",
      "amount_net": 84.03,
      "amount_vat": 0.0,
      "amount_gross": 84.03
    },
    {
      "description": "Sworn affidavit commissioner outlay [Outlay]",
      "quantity": 1.0,
      "unit_price": 27.95,
      "vat_rate_pct": 0.0,
      "vat_letter_code": "OUTLAY",
      "amount_net": 27.95,
      "amount_vat": 0.0,
      "amount_gross": 27.95
    }
  ],
  "ground_truth_header": {
    "vendor_name": "Kinsella Mulqueen Legal Services",
    "vendor_address_line1": "30 O'Murnaghan Street",
    "vendor_address_line2": "",
    "vendor_city": "Sligo",
    "vendor_eircode": "F91 35MC",
    "vendor_country": "IE",
    "vendor_phone": "+353 817 724 7478",
    "vendor_email": "nicholas15@sheane.com",
    "vendor_website": "",
    "vendor_vat_number": "IE5315399A",
    "vendor_iban": "IE34IPBS36614760918773",
    "vendor_bic": "IPBSIE2DXXX",
    "vendor_logo_present": "",
    "invoice_number": "INV-20260401-233",
    "invoice_date": "01/04/2026",
    "due_date": "",
    "po_reference": ""
  },
  "ground_truth_provenance": {
    "original_form": "digital_native",
    "source_engine": "weasyprint-68.1+jinja2",
    "file_sha256": "ae19199c80d37673651acab0346c3d910f36f07ede94661e3000cf4d34c8373f",
    "file_size_bytes": 24888,
    "ingest_timestamp_utc": "2026-05-04T17:33:55Z",
    "page_count": 1,
    "vatca_attestation": "original-form-preserved"
  },
  "synthetic_seed": 42000,
  "synthetic_generator_commit": "2284ec7dd2fab67c23c8c0b068ac6b638896c07a",
  "license_tag": "Apache-2.0"
}