{
  "doc_id": "synth-dc79d2614c1b",
  "source_path": "corpus/synth-prototype/supermarket_per_letter_vat/synth-dc79d2614c1b.pdf",
  "schema_version": "0.4",
  "contracts_version": "0.4.2-step0.1",
  "template_family": "supermarket_per_letter_vat",
  "corruption_bucket": "clean",
  "ground_truth_fields": {
    "vendor": "TESCO IRELAND",
    "total": 224.69,
    "vat": 16.06,
    "date": "05/02/2026",
    "subtotal": 208.63,
    "vendor_country": "IE"
  },
  "ground_truth_line_items": [
    {
      "description": "Cheddar cheese 400g",
      "quantity": 2.0,
      "unit_price": 3.72,
      "vat_rate_pct": 0.0,
      "vat_letter_code": "Z",
      "amount_net": 7.44,
      "amount_vat": 0.0,
      "amount_gross": 7.44
    },
    {
      "description": "Free-range eggs 12-pack",
      "quantity": 3.0,
      "unit_price": 3.93,
      "vat_rate_pct": 0.0,
      "vat_letter_code": "Z",
      "amount_net": 11.79,
      "amount_vat": 0.0,
      "amount_gross": 11.79
    },
    {
      "description": "Chicken breast fillets 600g",
      "quantity": 3.0,
      "unit_price": 7.45,
      "vat_rate_pct": 0.0,
      "vat_letter_code": "Z",
      "amount_net": 22.35,
      "amount_vat": 0.0,
      "amount_gross": 22.35
    },
    {
      "description": "Pringles Original 200g",
      "quantity": 2.0,
      "unit_price": 3.12,
      "vat_rate_pct": 23.0,
      "vat_letter_code": "A",
      "amount_net": 5.07,
      "amount_vat": 1.17,
      "amount_gross": 6.24
    },
    {
      "description": "2L milk",
      "quantity": 2.0,
      "unit_price": 2.53,
      "vat_rate_pct": 0.0,
      "vat_letter_code": "Z",
      "amount_net": 5.06,
      "amount_vat": 0.0,
      "amount_gross": 5.06
    },
    {
      "description": "Chicken breast fillets 600g",
      "quantity": 3.0,
      "unit_price": 7.3,
      "vat_rate_pct": 0.0,
      "vat_letter_code": "Z",
      "amount_net": 21.9,
      "amount_vat": 0.0,
      "amount_gross": 21.9
    },
    {
      "description": "Firelogs 6-pack",
      "quantity": 2.0,
      "unit_price": 8.99,
      "vat_rate_pct": 13.5,
      "vat_letter_code": "B",
      "amount_net": 15.84,
      "amount_vat": 2.14,
      "amount_gross": 17.98
    },
    {
      "description": "Irish Times Saturday",
      "quantity": 2.0,
      "unit_price": 4.19,
      "vat_rate_pct": 9.0,
      "vat_letter_code": "C",
      "amount_net": 7.69,
      "amount_vat": 0.69,
      "amount_gross": 8.38
    },
    {
      "description": "Olive oil 500ml",
      "quantity": 2.0,
      "unit_price": 4.84,
      "vat_rate_pct": 0.0,
      "vat_letter_code": "Z",
      "amount_net": 9.68,
      "amount_vat": 0.0,
      "amount_gross": 9.68
    },
    {
      "description": "Pringles Original 200g",
      "quantity": 3.0,
      "unit_price": 3.37,
      "vat_rate_pct": 23.0,
      "vat_letter_code": "A",
      "amount_net": 8.22,
      "amount_vat": 1.89,
      "amount_gross": 10.11
    },
    {
      "description": "Bananas (per kg)",
      "quantity": 2.0,
      "unit_price": 1.67,
      "vat_rate_pct": 0.0,
      "vat_letter_code": "Z",
      "amount_net": 3.34,
      "amount_vat": 0.0,
      "amount_gross": 3.34
    },
    {
      "description": "Irish Times Saturday",
      "quantity": 2.0,
      "unit_price": 4.14,
      "vat_rate_pct": 9.0,
      "vat_letter_code": "C",
      "amount_net": 7.6,
      "amount_vat": 0.68,
      "amount_gross": 8.28
    },
    {
      "description": "Bananas (per kg)",
      "quantity": 1.0,
      "unit_price": 1.64,
      "vat_rate_pct": 0.0,
      "vat_letter_code": "Z",
      "amount_net": 1.64,
      "amount_vat": 0.0,
      "amount_gross": 1.64
    },
    {
      "description": "Coca-Cola 1.75L",
      "quantity": 3.0,
      "unit_price": 3.32,
      "vat_rate_pct": 23.0,
      "vat_letter_code": "A",
      "amount_net": 8.1,
      "amount_vat": 1.86,
      "amount_gross": 9.96
    },
    {
      "description": "Cadbury Dairy Milk 200g",
      "quantity": 1.0,
      "unit_price": 3.49,
      "vat_rate_pct": 23.0,
      "vat_letter_code": "A",
      "amount_net": 2.84,
      "amount_vat": 0.65,
      "amount_gross": 3.49
    },
    {
      "description": "Potatoes 5kg sack",
      "quantity": 3.0,
      "unit_price": 4.25,
      "vat_rate_pct": 0.0,
      "vat_letter_code": "Z",
      "amount_net": 12.75,
      "amount_vat": 0.0,
      "amount_gross": 12.75
    },
    {
      "description": "Briquettes 12.5kg pack",
      "quantity": 2.0,
      "unit_price": 8.7,
      "vat_rate_pct": 13.5,
      "vat_letter_code": "B",
      "amount_net": 15.33,
      "amount_vat": 2.07,
      "amount_gross": 17.4
    },
    {
      "description": "Brown rice 1kg",
      "quantity": 3.0,
      "unit_price": 2.44,
      "vat_rate_pct": 0.0,
      "vat_letter_code": "Z",
      "amount_net": 7.32,
      "amount_vat": 0.0,
      "amount_gross": 7.32
    },
    {
      "description": "Irish Times Saturday",
      "quantity": 2.0,
      "unit_price": 3.86,
      "vat_rate_pct": 9.0,
      "vat_letter_code": "C",
      "amount_net": 7.08,
      "amount_vat": 0.64,
      "amount_gross": 7.72
    },
    {
      "description": "Cadbury Dairy Milk 200g",
      "quantity": 2.0,
      "unit_price": 3.54,
      "vat_rate_pct": 23.0,
      "vat_letter_code": "A",
      "amount_net": 5.76,
      "amount_vat": 1.32,
      "amount_gross": 7.08
    },
    {
      "description": "Firelogs 6-pack",
      "quantity": 3.0,
      "unit_price": 8.26,
      "vat_rate_pct": 13.5,
      "vat_letter_code": "B",
      "amount_net": 21.83,
      "amount_vat": 2.95,
      "amount_gross": 24.78
    }
  ],
  "ground_truth_header": {
    "vendor_name": "TESCO IRELAND",
    "vendor_address_line1": "43 Quin Street",
    "vendor_address_line2": "",
    "vendor_city": "Kilkenny",
    "vendor_eircode": "",
    "vendor_country": "IE",
    "vendor_phone": "+353 844 314 8487",
    "vendor_email": "walterdaire@logan.biz",
    "vendor_website": "",
    "vendor_vat_number": "IE7708184BN",
    "vendor_iban": "IE63IPBS46320676128213",
    "vendor_bic": "IPBSIE2DXXX",
    "vendor_logo_present": "",
    "invoice_number": "#982735",
    "invoice_date": "05/02/2026",
    "due_date": "",
    "po_reference": ""
  },
  "ground_truth_provenance": {
    "original_form": "digital_native",
    "source_engine": "weasyprint-68.1+jinja2",
    "file_sha256": "9fd45eede67ed91bea5e9434bbaae34d7a677da2a53c1063c77fb44e518c2284",
    "file_size_bytes": 16861,
    "ingest_timestamp_utc": "2026-05-04T17:44:48Z",
    "page_count": 1,
    "vatca_attestation": "original-form-preserved"
  },
  "synthetic_seed": 42003,
  "synthetic_generator_commit": "53bcbe180b1440a6e2b18057674ecaa736d20844",
  "license_tag": "Apache-2.0"
}