{
  "doc_id": "synth-5daabbcfdac9",
  "source_path": "corpus/synth-prototype/credit_note/synth-5daabbcfdac9.pdf",
  "schema_version": "0.4",
  "contracts_version": "0.4.2-step0.1",
  "template_family": "credit_note",
  "corruption_bucket": "clean",
  "ground_truth_fields": {
    "vendor": "Beggan Ltd",
    "total": -6080.53,
    "vat": -1137.01,
    "date": "01/04/2026",
    "subtotal": -4943.52,
    "vendor_country": "IE"
  },
  "ground_truth_line_items": [
    {
      "description": "Electrical — consumer unit upgrade",
      "quantity": 3.0,
      "unit_price": 1132.93,
      "vat_rate_pct": 23.0,
      "vat_letter_code": null,
      "amount_net": -3398.79,
      "amount_vat": -781.72,
      "amount_gross": -4180.51
    },
    {
      "description": "Electrical — consumer unit upgrade",
      "quantity": 1.0,
      "unit_price": 1055.25,
      "vat_rate_pct": 23.0,
      "vat_letter_code": null,
      "amount_net": -1055.25,
      "amount_vat": -242.71,
      "amount_gross": -1297.96
    },
    {
      "description": "Carpentry — wardrobe assembly + fitting",
      "quantity": 3.0,
      "unit_price": 163.16,
      "vat_rate_pct": 23.0,
      "vat_letter_code": null,
      "amount_net": -489.48,
      "amount_vat": -112.58,
      "amount_gross": -602.06
    }
  ],
  "ground_truth_header": {
    "vendor_name": "Beggan Ltd",
    "vendor_address_line1": "25 Mulroy Street",
    "vendor_address_line2": "Apt 21",
    "vendor_city": "Ennis",
    "vendor_eircode": "V95 JVL1",
    "vendor_country": "IE",
    "vendor_phone": "+353 807 401 4234",
    "vendor_email": "mlinehan@mannix-mcentaggart.info",
    "vendor_website": "",
    "vendor_vat_number": "IE5557217Q",
    "vendor_iban": "IE14NTSB39267598240440",
    "vendor_bic": "NTSBIE2D",
    "vendor_logo_present": "",
    "invoice_number": "CN-20260401-166",
    "invoice_date": "01/04/2026",
    "due_date": "",
    "po_reference": ""
  },
  "ground_truth_provenance": {
    "original_form": "digital_native",
    "source_engine": "weasyprint-68.1+jinja2",
    "file_sha256": "cce67c6930bf2b9b2397aa51ac0d14ba5165842cf92d84387e477795f5404ed4",
    "file_size_bytes": 20024,
    "ingest_timestamp_utc": "2026-05-04T17:53:20Z",
    "page_count": 1,
    "vatca_attestation": "original-form-preserved"
  },
  "synthetic_seed": 42004,
  "synthetic_generator_commit": "f530abec55959e790d43bc715fa59bc08bcb9c70",
  "license_tag": "Apache-2.0"
}