{
  "doc_id": "synth-925cd46cad8d",
  "source_path": "corpus/synth-prototype/bank_statement/synth-925cd46cad8d.pdf",
  "schema_version": "0.4",
  "contracts_version": "0.4.2-step0.1",
  "template_family": "bank_statement",
  "corruption_bucket": "clean",
  "ground_truth_fields": {
    "vendor": "Revolut Bank UAB",
    "total": 13333.87,
    "vat": 0.0,
    "date": "11/02/2026",
    "subtotal": 13333.87,
    "vendor_country": "IE"
  },
  "ground_truth_line_items": [
    {
      "description": "CUSTOMER PAYMENT — INV",
      "quantity": 1.0,
      "unit_price": 2387.51,
      "vat_rate_pct": 0.0,
      "vat_letter_code": "EXEMPT",
      "amount_net": 2387.51,
      "amount_vat": 0.0,
      "amount_gross": 2387.51
    },
    {
      "description": "VISA AMAZON.IE",
      "quantity": 1.0,
      "unit_price": 309.55,
      "vat_rate_pct": 0.0,
      "vat_letter_code": "EXEMPT",
      "amount_net": 309.55,
      "amount_vat": 0.0,
      "amount_gross": 309.55
    },
    {
      "description": "VISA SHELL FORECOURT LIMERICK",
      "quantity": 1.0,
      "unit_price": 76.67,
      "vat_rate_pct": 0.0,
      "vat_letter_code": "EXEMPT",
      "amount_net": 76.67,
      "amount_vat": 0.0,
      "amount_gross": 76.67
    },
    {
      "description": "INTEREST CREDIT",
      "quantity": 1.0,
      "unit_price": 16.24,
      "vat_rate_pct": 0.0,
      "vat_letter_code": "EXEMPT",
      "amount_net": 16.24,
      "amount_vat": 0.0,
      "amount_gross": 16.24
    },
    {
      "description": "D/D BORD GÁIS ENERGY",
      "quantity": 1.0,
      "unit_price": 91.06,
      "vat_rate_pct": 0.0,
      "vat_letter_code": "EXEMPT",
      "amount_net": 91.06,
      "amount_vat": 0.0,
      "amount_gross": 91.06
    },
    {
      "description": "VISA AMAZON.IE",
      "quantity": 1.0,
      "unit_price": 161.81,
      "vat_rate_pct": 0.0,
      "vat_letter_code": "EXEMPT",
      "amount_net": 161.81,
      "amount_vat": 0.0,
      "amount_gross": 161.81
    },
    {
      "description": "VISA APPLE.COM IRELAND",
      "quantity": 1.0,
      "unit_price": 24.19,
      "vat_rate_pct": 0.0,
      "vat_letter_code": "EXEMPT",
      "amount_net": 24.19,
      "amount_vat": 0.0,
      "amount_gross": 24.19
    },
    {
      "description": "D/D STRIPE PAYMENTS EUROPE",
      "quantity": 1.0,
      "unit_price": 79.91,
      "vat_rate_pct": 0.0,
      "vat_letter_code": "EXEMPT",
      "amount_net": 79.91,
      "amount_vat": 0.0,
      "amount_gross": 79.91
    },
    {
      "description": "REFUND — STRIPE.COM",
      "quantity": 1.0,
      "unit_price": 268.37,
      "vat_rate_pct": 0.0,
      "vat_letter_code": "EXEMPT",
      "amount_net": 268.37,
      "amount_vat": 0.0,
      "amount_gross": 268.37
    },
    {
      "description": "VISA SHELL FORECOURT LIMERICK",
      "quantity": 1.0,
      "unit_price": 83.05,
      "vat_rate_pct": 0.0,
      "vat_letter_code": "EXEMPT",
      "amount_net": 83.05,
      "amount_vat": 0.0,
      "amount_gross": 83.05
    },
    {
      "description": "VISA TESCO IRELAND LIMERICK",
      "quantity": 1.0,
      "unit_price": 141.94,
      "vat_rate_pct": 0.0,
      "vat_letter_code": "EXEMPT",
      "amount_net": 141.94,
      "amount_vat": 0.0,
      "amount_gross": 141.94
    },
    {
      "description": "D/D VHI HEALTHCARE",
      "quantity": 1.0,
      "unit_price": 330.01,
      "vat_rate_pct": 0.0,
      "vat_letter_code": "EXEMPT",
      "amount_net": 330.01,
      "amount_vat": 0.0,
      "amount_gross": 330.01
    },
    {
      "description": "D/D BORD GÁIS ENERGY",
      "quantity": 1.0,
      "unit_price": 107.38,
      "vat_rate_pct": 0.0,
      "vat_letter_code": "EXEMPT",
      "amount_net": 107.38,
      "amount_vat": 0.0,
      "amount_gross": 107.38
    },
    {
      "description": "CUSTOMER PAYMENT — INV",
      "quantity": 1.0,
      "unit_price": 2720.39,
      "vat_rate_pct": 0.0,
      "vat_letter_code": "EXEMPT",
      "amount_net": 2720.39,
      "amount_vat": 0.0,
      "amount_gross": 2720.39
    },
    {
      "description": "REFUND — STRIPE.COM",
      "quantity": 1.0,
      "unit_price": 173.71,
      "vat_rate_pct": 0.0,
      "vat_letter_code": "EXEMPT",
      "amount_net": 173.71,
      "amount_vat": 0.0,
      "amount_gross": 173.71
    },
    {
      "description": "VISA SHELL FORECOURT LIMERICK",
      "quantity": 1.0,
      "unit_price": 86.17,
      "vat_rate_pct": 0.0,
      "vat_letter_code": "EXEMPT",
      "amount_net": 86.17,
      "amount_vat": 0.0,
      "amount_gross": 86.17
    },
    {
      "description": "VISA DUNNES STORES SHANNON",
      "quantity": 1.0,
      "unit_price": 96.97,
      "vat_rate_pct": 0.0,
      "vat_letter_code": "EXEMPT",
      "amount_net": 96.97,
      "amount_vat": 0.0,
      "amount_gross": 96.97
    },
    {
      "description": "VISA DUNNES STORES SHANNON",
      "quantity": 1.0,
      "unit_price": 71.46,
      "vat_rate_pct": 0.0,
      "vat_letter_code": "EXEMPT",
      "amount_net": 71.46,
      "amount_vat": 0.0,
      "amount_gross": 71.46
    },
    {
      "description": "ATM CASH WITHDRAWAL",
      "quantity": 1.0,
      "unit_price": 200.71,
      "vat_rate_pct": 0.0,
      "vat_letter_code": "EXEMPT",
      "amount_net": 200.71,
      "amount_vat": 0.0,
      "amount_gross": 200.71
    },
    {
      "description": "REFUND — STRIPE.COM",
      "quantity": 1.0,
      "unit_price": 141.06,
      "vat_rate_pct": 0.0,
      "vat_letter_code": "EXEMPT",
      "amount_net": 141.06,
      "amount_vat": 0.0,
      "amount_gross": 141.06
    },
    {
      "description": "CUSTOMER PAYMENT — INV",
      "quantity": 1.0,
      "unit_price": 2215.73,
      "vat_rate_pct": 0.0,
      "vat_letter_code": "EXEMPT",
      "amount_net": 2215.73,
      "amount_vat": 0.0,
      "amount_gross": 2215.73
    },
    {
      "description": "D/D EIR BROADBAND",
      "quantity": 1.0,
      "unit_price": 43.89,
      "vat_rate_pct": 0.0,
      "vat_letter_code": "EXEMPT",
      "amount_net": 43.89,
      "amount_vat": 0.0,
      "amount_gross": 43.89
    },
    {
      "description": "D/D ESB ELECTRIC IRELAND",
      "quantity": 1.0,
      "unit_price": 117.98,
      "vat_rate_pct": 0.0,
      "vat_letter_code": "EXEMPT",
      "amount_net": 117.98,
      "amount_vat": 0.0,
      "amount_gross": 117.98
    },
    {
      "description": "STRIPE PAYOUT — owl studio",
      "quantity": 1.0,
      "unit_price": 1652.18,
      "vat_rate_pct": 0.0,
      "vat_letter_code": "EXEMPT",
      "amount_net": 1652.18,
      "amount_vat": 0.0,
      "amount_gross": 1652.18
    },
    {
      "description": "VISA AMAZON.IE",
      "quantity": 1.0,
      "unit_price": 274.19,
      "vat_rate_pct": 0.0,
      "vat_letter_code": "EXEMPT",
      "amount_net": 274.19,
      "amount_vat": 0.0,
      "amount_gross": 274.19
    },
    {
      "description": "VISA AMAZON.IE",
      "quantity": 1.0,
      "unit_price": 295.25,
      "vat_rate_pct": 0.0,
      "vat_letter_code": "EXEMPT",
      "amount_net": 295.25,
      "amount_vat": 0.0,
      "amount_gross": 295.25
    },
    {
      "description": "D/D STRIPE PAYMENTS EUROPE",
      "quantity": 1.0,
      "unit_price": 83.44,
      "vat_rate_pct": 0.0,
      "vat_letter_code": "EXEMPT",
      "amount_net": 83.44,
      "amount_vat": 0.0,
      "amount_gross": 83.44
    },
    {
      "description": "SALARY CREDIT",
      "quantity": 1.0,
      "unit_price": 4233.41,
      "vat_rate_pct": 0.0,
      "vat_letter_code": "EXEMPT",
      "amount_net": 4233.41,
      "amount_vat": 0.0,
      "amount_gross": 4233.41
    }
  ],
  "ground_truth_header": {
    "vendor_name": "Revolut Bank UAB",
    "vendor_address_line1": "25 Mulroy Street",
    "vendor_address_line2": "Apt 21",
    "vendor_city": "Ennis",
    "vendor_eircode": "V95 JVL1",
    "vendor_country": "IE",
    "vendor_phone": "+353 807 401 4234",
    "vendor_email": "mlinehan@mannix-mcentaggart.info",
    "vendor_website": "",
    "vendor_vat_number": "IE5557217Q",
    "vendor_iban": "IE14NTSB39267598240440",
    "vendor_bic": "NTSBIE2D",
    "vendor_logo_present": "",
    "invoice_number": "STMT-202602-885431",
    "invoice_date": "11/02/2026",
    "due_date": "",
    "po_reference": ""
  },
  "ground_truth_provenance": {
    "original_form": "digital_native",
    "source_engine": "weasyprint-68.1+jinja2",
    "file_sha256": "a713ebd255893bc86e6d846fe677e1e52a28f5bd4a1edb839cdb359a18af5caf",
    "file_size_bytes": 21542,
    "ingest_timestamp_utc": "2026-05-04T17:53:08Z",
    "page_count": 2,
    "vatca_attestation": "original-form-preserved"
  },
  "synthetic_seed": 42004,
  "synthetic_generator_commit": "f530abec55959e790d43bc715fa59bc08bcb9c70",
  "license_tag": "Apache-2.0"
}