{
  "doc_id": "synth-adaeb885c63f",
  "source_path": "corpus/synth-prototype/professional_services/synth-adaeb885c63f.pdf",
  "schema_version": "0.4",
  "contracts_version": "0.4.2-step0.1",
  "template_family": "professional_services",
  "corruption_bucket": "clean",
  "ground_truth_fields": {
    "vendor": "Grahams Marketing Studio",
    "total": 2696.49,
    "vat": 504.22,
    "date": "06/03/2026",
    "subtotal": 2192.27,
    "vendor_country": "IE"
  },
  "ground_truth_line_items": [
    {
      "description": "Annual accounts preparation + filing",
      "quantity": 1.0,
      "unit_price": 2192.27,
      "vat_rate_pct": 23.0,
      "vat_letter_code": null,
      "amount_net": 2192.27,
      "amount_vat": 504.22,
      "amount_gross": 2696.49
    }
  ],
  "ground_truth_header": {
    "vendor_name": "Grahams Marketing Studio",
    "vendor_address_line1": "59 O'Kennedy Street",
    "vendor_address_line2": "Apt 21",
    "vendor_city": "Galway",
    "vendor_eircode": "H53 T3XA",
    "vendor_country": "IE",
    "vendor_phone": "+353 816 167 2140",
    "vendor_email": "cosgravemaureen@moroney.com",
    "vendor_website": "",
    "vendor_vat_number": "IE5318360KY",
    "vendor_iban": "IE76AIBK71534183127508",
    "vendor_bic": "AIBKIE2DXXX",
    "vendor_logo_present": "",
    "invoice_number": "INV-20260306-764",
    "invoice_date": "06/03/2026",
    "due_date": "",
    "po_reference": ""
  },
  "ground_truth_provenance": {
    "original_form": "digital_native",
    "source_engine": "weasyprint-68.1+jinja2",
    "file_sha256": "47f6769468f1abb9c7a03dec075ce5bacacfd8e997705789ea4aac21aa67dfb4",
    "file_size_bytes": 18184,
    "ingest_timestamp_utc": "2026-05-04T17:52:54Z",
    "page_count": 1,
    "vatca_attestation": "original-form-preserved"
  },
  "synthetic_seed": 42002,
  "synthetic_generator_commit": "f530abec55959e790d43bc715fa59bc08bcb9c70",
  "license_tag": "Apache-2.0"
}