{
  "doc_id": "synth-a6d07c242c40",
  "source_path": "corpus/synth-prototype/cafe_receipt/synth-a6d07c242c40.pdf",
  "schema_version": "0.4",
  "contracts_version": "0.4.2-step0.1",
  "template_family": "cafe_receipt",
  "corruption_bucket": "clean",
  "ground_truth_fields": {
    "vendor": "Cogley Coffee Roasters",
    "total": 56.11,
    "vat": 4.64,
    "date": "05/02/2026",
    "subtotal": 51.47,
    "vendor_country": "IE"
  },
  "ground_truth_line_items": [
    {
      "description": "Scone with butter + jam",
      "quantity": 1.0,
      "unit_price": 4.47,
      "vat_rate_pct": 9.0,
      "vat_letter_code": null,
      "amount_net": 4.1,
      "amount_vat": 0.37,
      "amount_gross": 4.47
    },
    {
      "description": "Croissant",
      "quantity": 1.0,
      "unit_price": 4.09,
      "vat_rate_pct": 9.0,
      "vat_letter_code": null,
      "amount_net": 3.75,
      "amount_vat": 0.34,
      "amount_gross": 4.09
    },
    {
      "description": "Fresh-baked sourdough loaf",
      "quantity": 3.0,
      "unit_price": 5.89,
      "vat_rate_pct": 9.0,
      "vat_letter_code": null,
      "amount_net": 16.21,
      "amount_vat": 1.46,
      "amount_gross": 17.67
    },
    {
      "description": "Cappuccino",
      "quantity": 2.0,
      "unit_price": 4.12,
      "vat_rate_pct": 9.0,
      "vat_letter_code": null,
      "amount_net": 7.56,
      "amount_vat": 0.68,
      "amount_gross": 8.24
    },
    {
      "description": "Brown bread + smoked salmon",
      "quantity": 2.0,
      "unit_price": 10.82,
      "vat_rate_pct": 9.0,
      "vat_letter_code": null,
      "amount_net": 19.85,
      "amount_vat": 1.79,
      "amount_gross": 21.64
    }
  ],
  "ground_truth_header": {
    "vendor_name": "Cogley Coffee Roasters",
    "vendor_address_line1": "43 Quin Street",
    "vendor_address_line2": "Suite 21",
    "vendor_city": "Galway",
    "vendor_eircode": "",
    "vendor_country": "IE",
    "vendor_phone": "+353 843 567 8995",
    "vendor_email": "walterdaire@logan.biz",
    "vendor_website": "",
    "vendor_vat_number": "IE7081847N",
    "vendor_iban": "IE63IPBS46320676128213",
    "vendor_bic": "IPBSIE2DXXX",
    "vendor_logo_present": "",
    "invoice_number": "R77043",
    "invoice_date": "05/02/2026",
    "due_date": "",
    "po_reference": ""
  },
  "ground_truth_provenance": {
    "original_form": "digital_native",
    "source_engine": "weasyprint-68.1+jinja2",
    "file_sha256": "8000e7507235586cf0f8b37b429db53fdfc6278ab1c6c4207776dc73b85436ff",
    "file_size_bytes": 14700,
    "ingest_timestamp_utc": "2026-05-04T17:33:39Z",
    "page_count": 1,
    "vatca_attestation": "original-form-preserved"
  },
  "synthetic_seed": 42003,
  "synthetic_generator_commit": "2284ec7dd2fab67c23c8c0b068ac6b638896c07a",
  "license_tag": "Apache-2.0"
}